id,subtitle,title,img_url,level,level_code,link,time,element,feature
16,정성 가득 정갈한 차림상,채식구절판,https://static.wtable.co.kr/image/production/service/recipe/1942/22f6aea0-ced5-4269-8afd-69c64935f50c.jpg?size=500x500,중급,1,https://wtable.co.kr/recipes/tg2DqpEVwGzQMS66bSehzAxQ?location=recipe_home,40분,"['표고', '오이', '당근', '숙주', '애호박', '우엉', '목이버섯', '소금', '식용유', '밀가루', '물', '소금', '참기름', '간장', '맛술', '설탕', '다진 마늘', '참기름', '후춧가루', '연겨자', '간장', '식초', '설탕', '후춧가루', '부', '침', '가', '루', '간', '장', '설', '탕', '매', '실', '청', ' ', '후', '추', '물', '깨', '소', '금', '초', '이', '스', '레', '시', '피', ' ', '분', '말', '육', '수', '후', '춧', '가', '루', '굴', '소', '스', '후', '춧', '가', '루', '설', '탕', '통', '깨', '깨', '생', '강', '즙', '장', '김', '치', ' ', '채', '소', '맛', '술', '고', '춧', '가', '루', '맛', '술', '식', '초', '맛', '술', '다', '진', ' ', '마', '늘', '간', '장', '올', '리', '고', '당', '식', '초', '고', '춧', '가', '루', '생', '강', '가', '루', '다', '진', ' ', '마', '늘', '후', '춧', '가', '루', '들', '기', '름', '설', '탕', '참', '기', '름', '씨', '를', ' ', '제', '거', ' ', '한', '\xa0', '홍', '고', '추', '통', '후', '추', '들', '기', '름', '통', '깨', '월', '계', '수', ' ', '잎', '다', '진', ' ', '마', '늘', '후', '춧', '가', '루', '후', '춧', '가', '루', '다', '진', ' ', '마', '늘', '다', '진', ' ', '마', '늘', '다', '진', ' ', '마', '늘', '식', '초', '식', '초', '다', '시', '마', ' ', '물', '물', '후', '춧', '가', '루', '간', '장', '실', '고', '추', ' ', '액', '젓', '후', '춧', '가', '루', '맛', '술', '굴', '소', '스', '후', '춧', '가', '루', '다', '시', '마', ' ', '고', '추', '장', '후', '춧', '가', '루', '설', '탕', '식', '초', '후', '춧', '가', '루', '후', '춧', '가', '루', '후', '춧', '가', '루', '후', '춧', '가', '루', '다', '진', ' ', '마', '늘', '맛', '술', '찹', '쌀', '가', '루', '소', '금', '통', '깨', '다', '진', ' ', '파', '참', '기', '름', '다', '진', ' ', '생', '강', '소', '금', '간', '장', '다', '진', ' ', '마', '늘', '참', '기', '름', '통', '깨', '후', '춧', '가', '루', '간', '장', '굴', '소', '스', '잘', '게', ' ', '썬', ' ', '청', '홍', '고', '추', '맛', '술', '후', '춧', '가', '루', '통', '깨', '후', '춧', '가', '루', '청', '양', '고', '추', '참', '기', '름', '간', '장', '참', '기', '름', '간', '장', '월', '계', '수', '잎', '구', '운', ' ', '굵', '은', ' ', '소', '금', '식', '초', '다', '진', ' ', '파', '고', '춧', '가', '루', '후', '추', '두', '부', '참', '기', '름', '다', '진', '마', '늘', '국', '간', '장', '다', '진', ' ', '마', '늘', '깍', '두', '기', ' ', '국', '물', '다', '진', '마', '늘', '다', '진', '마', '늘', '냉', '면', '육', '수', '다', '진', '마', '늘', '참', '기', '름', '마', '요', '네', '즈', '생', '강', '즙', '고', '춧', '가', '루', '다', '진', '양', '파', '올', '리', '고', '당', '다', '진', '마', '늘', '두', '부', '후', '춧', '가', '루', '식', '초', '다', '진', '마', '늘', '참', '치', '액', '젓', '부', '침', '가', '루', '생', '강', '가', '루', '참', '기', '름', '다', '진', '마', '늘', '간', '장', '간', '장', '간', '장', '후', '춧', '가', '루', '후', '추', '생', '강', '가', '루', '다', '진', '마', '늘', '고', '추', '장', '소', '금', '참', '기', '름', '깨', '생', '강', '가', '루', '다', '진', '마', '늘', '다', '진', '마', '늘', '맛', '술', '물', '후', '추', '맛', '술']",정성 가득 정갈한 차림상 채식구절판  표고 오이 당근 숙주 애호박 우엉 목이버섯 소금 식용유 밀가루 물 소금 참기름 간장 맛술 설탕 다진 마늘 참기름 후춧가루 연겨자 간장 식초 설탕 후춧가루 부 침 가 루 간 장 설 탕 매 실 청 후 추 물 깨 소 금 초 이 스 레 시 피 분 말 육 수 후 춧 가 루 굴 소 스 후 춧 가 루 설 탕 통 깨 깨 생 강 즙 장 김 치 채 소 맛 술 고 춧 가 루 맛 술 식 초 맛 술 다 진 마 늘 간 장 올 리 고 당 식 초 고 춧 가 루 생 강 가 루 다 진 마 늘 후 춧 가 루 들 기 름 설 탕 참 기 름 씨 를 제 거 한 홍 고 추 통 후 추 들 기 름 통 깨 월 계 수 잎 다 진 마 늘 후 춧 가 루 후 춧 가 루 다 진 마 늘 다 진 마 늘 다 진 마 늘 식 초 식 초 다 시 마 물 물 후 춧 가 루 간 장 실 고 추 액 젓 후 춧 가 루 맛 술 굴 소 스 후 춧 가 루 다 시 마 고 추 장 후 춧 가 루 설 탕 식 초 후 춧 가 루 후 춧 가 루 후 춧 가 루 후 춧 가 루 다 진 마 늘 맛 술 찹 쌀 가 루 소 금 통 깨 다 진 파 참 기 름 다 진 생 강 소 금 간 장 다 진 마 늘 참 기 름 통 깨 후 춧 가 루 간 장 굴 소 스 잘 게 썬 청 홍 고 추 맛 술 후 춧 가 루 통 깨 후 춧 가 루 청 양 고 추 참 기 름 간 장 참 기 름 간 장 월 계 수 잎 구 운 굵 은 소 금 식 초 다 진 파 고 춧 가 루 후 추 두 부 참 기 름 다 진 마 늘 국 간 장 다 진 마 늘 깍 두 기 국 물 다 진 마 늘 다 진 마 늘 냉 면 육 수 다 진 마 늘 참 기 름 마 요 네 즈 생 강 즙 고 춧 가 루 다 진 양 파 올 리 고 당 다 진 마 늘 두 부 후 춧 가 루 식 초 다 진 마 늘 참 치 액 젓 부 침 가 루 생 강 가 루 참 기 름 다 진 마 늘 간 장 간 장 간 장 후 춧 가 루 후 추 생 강 가 루 다 진 마 늘 고 추 장 소 금 참 기 름 깨 생 강 가 루 다 진 마 늘 다 진 마 늘 맛 술 물 후 추 맛 술 
17,간장 베이스로 더욱 감칠맛 있는,간장 가지덮밥,https://static.wtable.co.kr/image/production/service/recipe/1940/4c5b3a9b-b3ae-4dc7-b5bd-33acb36212e6.jpg?size=500x500,초급,0,https://wtable.co.kr/recipes/V6Y9nsDkHCW64RaHET3ohCiL?location=recipe_home,25분,"['가지', '양파', '전분', '쪽파', '식용유', '통깨', '후춧가루', '소금', '설탕', '물', '간장', '미림', '청주', '설탕', '생강가루', '진', '간', '장', '설', '탕', '다', '진', ' ', '마', '늘', '통', '깨', '굵', '은', ' ', '소', '금', '후', '춧', '가', '루', '물', '맛', '술', '참', '기', '름', '후', '춧', '가', '루', '장', '김', '치', ' ', '국', '물', '간', '장', '다', '진', '마', '늘', '설', '탕', '맛', '술', '통', '깨', '깨', '소', '금', '설', '탕', '물', '고', '추', '기', '름', '다', '진', ' ', '마', '늘', '참', '치', '액', '젓', '참', '기', '름', '참', '기', '름', '통', '깨', '배', '간', '장', '소', '금', '물', '다', '진', ' ', '청', '양', '고', '추', '참', '치', '액', '고', '춧', '가', '루', '맛', '술', '후', '춧', '가', '루', '다', '진', ' ', '마', '늘', '물', '엿', '맛', '술', '쪽', '파', ' ', '후', '춧', '가', '루', '국', '간', '장', '설', '탕', '간', '장', '들', '기', '름', '소', '금', '참', '기', '름', '참', '기', '름', '다', '진', '마', '늘', '멸', '치', '다', '시', '육', '수', '후', '춧', '가', '루', '다', '진', ' ', '마', '늘', '깨', '소', '금', '참', '기', '름', '설', '탕', '후', '춧', '가', '루', '통', '깨', '간', '장', '맛', '술', '설', '탕', '연', '겨', '자', '간', '장', '건', '고', '추', '후', '춧', '가', '루', '참', '치', '액', '젓', '다', '진', '마', '늘', '설', '탕', '통', '후', '추', '소', '금', '고', '춧', '가', '루', '다', '진', ' ', '마', '늘', '물', '통', '깨', '후', '춧', '가', '루', '후', '춧', '가', '루', '고', '춧', '가', '루', '설', '탕', '연', '겨', '자', '물', '참', '기', '름', '후', '춧', '가', '루', '설', '탕', '맛', '술', '간', '장', '후', '춧', '가', '루', '물', '파', '양', '파', '파', '슬', '리', '가', '루', '간', '장', '소', '금', '소', '금', '찬', '물', '후', '춧', '가', '루', '소', '금', '참', '기', '름', '설', '탕', '맛', '술', '맛', '술', '고', '추', '장', '후', '춧', '가', '루', '후', '춧', '가', '루', '올', '리', '고', '당', '후', '춧', '가', '루', '생', '강', '가', '루', '후', '추', '후', '추', '생', '강', '즙', '참', '기', '름', '다', '진', '마', '늘', '간', '장', '.', ' ', '굴', '소', '스', '.', ' ', '설', '탕', '다', '진', '마', '늘']",간장 베이스로 더욱 감칠맛 있는 간장 가지덮밥  가지 양파 전분 쪽파 식용유 통깨 후춧가루 소금 설탕 물 간장 미림 청주 설탕 생강가루 진 간 장 설 탕 다 진 마 늘 통 깨 굵 은 소 금 후 춧 가 루 물 맛 술 참 기 름 후 춧 가 루 장 김 치 국 물 간 장 다 진 마 늘 설 탕 맛 술 통 깨 깨 소 금 설 탕 물 고 추 기 름 다 진 마 늘 참 치 액 젓 참 기 름 참 기 름 통 깨 배 간 장 소 금 물 다 진 청 양 고 추 참 치 액 고 춧 가 루 맛 술 후 춧 가 루 다 진 마 늘 물 엿 맛 술 쪽 파 후 춧 가 루 국 간 장 설 탕 간 장 들 기 름 소 금 참 기 름 참 기 름 다 진 마 늘 멸 치 다 시 육 수 후 춧 가 루 다 진 마 늘 깨 소 금 참 기 름 설 탕 후 춧 가 루 통 깨 간 장 맛 술 설 탕 연 겨 자 간 장 건 고 추 후 춧 가 루 참 치 액 젓 다 진 마 늘 설 탕 통 후 추 소 금 고 춧 가 루 다 진 마 늘 물 통 깨 후 춧 가 루 후 춧 가 루 고 춧 가 루 설 탕 연 겨 자 물 참 기 름 후 춧 가 루 설 탕 맛 술 간 장 후 춧 가 루 물 파 양 파 파 슬 리 가 루 간 장 소 금 소 금 찬 물 후 춧 가 루 소 금 참 기 름 설 탕 맛 술 맛 술 고 추 장 후 춧 가 루 후 춧 가 루 올 리 고 당 후 춧 가 루 생 강 가 루 후 추 후 추 생 강 즙 참 기 름 다 진 마 늘 간 장 굴 소 스 설 탕 다 진 마 늘 
18,매콤새콤 입맛 돋우는,김치 비빔 국수,https://static.wtable.co.kr/image/production/service/recipe/1923/f513c7bf-0572-475c-95b7-b98771ab7618.jpg?size=500x500,초급,0,https://wtable.co.kr/recipes/QDk9nnKsEerfspNHrRtT9Gpp?location=recipe_home,25분,"['신김치', '중면', '오이', '깨', '고추장', '식초', '올리고당', '간장', '설탕', '맛술', '참기름', '후추', '물', '미', '림', '참', '기', '름', '식', '초', '소', '금', '생', '강', '가', '루', '참', '기', '름', '들', '기', '름', '물', '엿', '참', '기', '름', '설', '탕', '다', '진', ' ', '파', '참', '기', '름', '다', '진', ' ', '청', '양', '고', '추', '통', '깨', '물', '무', '맛', '술', '통', '깨', '맛', '술', '참', '기', '름', '국', '간', '장', '후', '춧', '가', '루', '소', '금', '전', '분', '가', '루', '참', '기', '름', '다', '진', ' ', '마', '늘', '청', '하', '다', '진', ' ', '마', '늘', '물', '엿', '맛', '술', '참', '기', '름', '밀', '가', '루', ' ', '생', '강', '가', '루', '굵', '은', '소', '금', '생', '강', '가', '루', '후', '춧', '가', '루', '통', '깨', '식', '초', '맛', '술', '올', '리', '고', '당', '다', '진', '마', '늘', '소', '금', '물', '엿', '통', '후', '추', '설', '탕', '생', '강', '가', '루', '다', '진', ' ', '파', '고', '춧', '가', '루', '다', '진', ' ', '대', '파', '참', '기', '름', '생', '강', '즙', '간', '장', '다', '진', '마', '늘', '땅', '콩', '버', '터', '맛', '술', '올', '리', '고', '당', '참', '깨', '초', '고', '추', '장', '후', '춧', '가', '루', '소', '금', '설', '탕', '맛', '술', '소', '금', '후', '추', '당', '근', '소', '금', '후', '추', '후', '춧', '가', '루', '달', '걀', '맛', '술', '후', '춧', '가', '루', '깨', '소', '금', '식', '초', '설', '탕', '설', '탕', '올', '리', '고', '당', '다', '진', '마', '늘', '후', '춧', '가', '루', '후', '추', '후', '추', '참', '기', '름', '고', '춧', '가', '루', '.', ' ', '다', '진', ' ', '마', '늘', '설', '탕']",매콤새콤 입맛 돋우는 김치 비빔 국수  신김치 중면 오이 깨 고추장 식초 올리고당 간장 설탕 맛술 참기름 후추 물 미 림 참 기 름 식 초 소 금 생 강 가 루 참 기 름 들 기 름 물 엿 참 기 름 설 탕 다 진 파 참 기 름 다 진 청 양 고 추 통 깨 물 무 맛 술 통 깨 맛 술 참 기 름 국 간 장 후 춧 가 루 소 금 전 분 가 루 참 기 름 다 진 마 늘 청 하 다 진 마 늘 물 엿 맛 술 참 기 름 밀 가 루 생 강 가 루 굵 은 소 금 생 강 가 루 후 춧 가 루 통 깨 식 초 맛 술 올 리 고 당 다 진 마 늘 소 금 물 엿 통 후 추 설 탕 생 강 가 루 다 진 파 고 춧 가 루 다 진 대 파 참 기 름 생 강 즙 간 장 다 진 마 늘 땅 콩 버 터 맛 술 올 리 고 당 참 깨 초 고 추 장 후 춧 가 루 소 금 설 탕 맛 술 소 금 후 추 당 근 소 금 후 추 후 춧 가 루 달 걀 맛 술 후 춧 가 루 깨 소 금 식 초 설 탕 설 탕 올 리 고 당 다 진 마 늘 후 춧 가 루 후 추 후 추 참 기 름 고 춧 가 루 다 진 마 늘 설 탕 
19,시원하고 개운한 맛,열무김치,https://static.wtable.co.kr/image/production/service/recipe/1918/ca94f751-0f27-4221-8feb-d9cece691a03.jpg?size=500x500,중급,1,https://wtable.co.kr/recipes/8gBEJ7geKSHU5By6NgxCL6LD?location=recipe_home,2시간,"['열무', '얼갈이', '쪽파', '양파', '홍고추', '생강', '새우젓', '굵은 소금', '고춧가루', '참치액젓', '다진 마늘', '매실청', '소금', '밀가루', '디포리 다시마 육수', '설', '탕', '굴', '소', '스', '후', '춧', '가', '루', '후', '춧', '가', '루', '다', '진', ' ', '마', '늘', '통', '깨', '물', '통', '깨', '고', '춧', '가', '루', '다', '진', ' ', '마', '늘', '고', '춧', '가', '루', '참', '기', '름', '다', '진', ' ', '파', '후', '춧', '가', '루', '다', '진', ' ', '마', '늘', '다', '진', ' ', '마', '늘', '식', '초', '간', '장', '매', '실', '청', '다', '진', ' ', '마', '늘', '후', '춧', '가', '루', '물', '후', '춧', '가', '루', '참', '기', '름', '설', '탕', '새', '우', '젓', '다', '진', ' ', '마', '늘', '설', '탕', '소', '금', '물', '후', '춧', '가', '루', '후', '춧', '가', '루', '통', '깨', '간', '장', '간', '장', '물', '설', '탕', '설', '탕', '생', '강', '가', '루', '후', '춧', '가', '루', '물', '마', '늘', '다', '진', ' ', '마', '늘', '물', '다', '진', ' ', '마', '늘', '된', '장', '다', '진', ' ', '마', '늘', '통', '깨', '후', '춧', '가', '루', '연', '와', '사', '비', '국', '간', '장', '물', '다', '진', ' ', '마', '늘', '카', '레', '가', '루', '당', '근', '설', '탕', '물', '후', '춧', '가', '루', '후', '춧', '가', '루', '올', '리', '고', '당', '참', '기', '름', '참', '기', '름', '다', '진', '마', '늘', '통', '깨', '물', '소', '금', '간', '장', '물', '엿', '다', '진', '마', '늘', '물', '엿', '참', '기', '름', '설', '탕', '후', '춧', '가', '루', '후', '추', '올', '리', '고', '당']",시원하고 개운한 맛 열무김치  열무 얼갈이 쪽파 양파 홍고추 생강 새우젓 굵은 소금 고춧가루 참치액젓 다진 마늘 매실청 소금 밀가루 디포리 다시마 육수 설 탕 굴 소 스 후 춧 가 루 후 춧 가 루 다 진 마 늘 통 깨 물 통 깨 고 춧 가 루 다 진 마 늘 고 춧 가 루 참 기 름 다 진 파 후 춧 가 루 다 진 마 늘 다 진 마 늘 식 초 간 장 매 실 청 다 진 마 늘 후 춧 가 루 물 후 춧 가 루 참 기 름 설 탕 새 우 젓 다 진 마 늘 설 탕 소 금 물 후 춧 가 루 후 춧 가 루 통 깨 간 장 간 장 물 설 탕 설 탕 생 강 가 루 후 춧 가 루 물 마 늘 다 진 마 늘 물 다 진 마 늘 된 장 다 진 마 늘 통 깨 후 춧 가 루 연 와 사 비 국 간 장 물 다 진 마 늘 카 레 가 루 당 근 설 탕 물 후 춧 가 루 후 춧 가 루 올 리 고 당 참 기 름 참 기 름 다 진 마 늘 통 깨 물 소 금 간 장 물 엿 다 진 마 늘 물 엿 참 기 름 설 탕 후 춧 가 루 후 추 올 리 고 당 
20,미역국의 정석,쇠고기 미역국,https://static.wtable.co.kr/image/production/service/recipe/1917/d912095b-45ad-4d94-9fad-c80257b2d838.jpg?size=500x500,초급,0,https://wtable.co.kr/recipes/Yg6T2drYTBBbrbMRGccZ2XX6?location=recipe_home,50분,"['자른 쇠고기 양지', '자른 미역', '참기름 ', '국간장', '다진 마늘', '물 ', '멸치 액젓 ', '식', '초', '연', '겨', '자', '후', '춧', '가', '루', '김', '가', '루', '식', '초', '다', '진', ' ', '청', '양', '고', '추', '후', '춧', '가', '루', '김', '치', ' ', '국', '물', '통', '깨', '다', '진', ' ', '생', '강', '설', '탕', '물', '굴', '소', '스', '통', '깨', '구', '운', ' ', '소', '금', '통', '깨', '통', '깨', '매', '실', '청', '후', '춧', '가', '루', '생', '강', '가', '루', '물', '엿', '통', '깨', '밀', '가', '루', ' ', '후', '춧', '가', '루', '맛', '술', '맛', '술', '올', '리', '고', '당', '후', '춧', '가', '루', '후', '춧', '가', '루', '설', '탕', '식', '초', '생', '강', '구', '운', ' ', '소', '금', '후', '춧', '가', '루', '후', '춧', '가', '루', '고', '추', '장', '참', '기', '름', '소', '금', '설', '탕', '다', '진', ' ', '파', '후', '춧', '가', '루', '쥬', '키', '니', ' ', '호', '박', '식', '초', '간', '장', '설', '탕', '다', '진', '파', '맛', '술', '식', '용', '유', '맛', '술', '다', '진', '마', '늘', '생', '강', '가', '루', '다', '진', '파', '간', '장', '생', '강', '즙', '생', '강', '즙']",미역국의 정석 쇠고기 미역국  자른 쇠고기 양지 자른 미역 참기름 국간장 다진 마늘 물 멸치 액젓 식 초 연 겨 자 후 춧 가 루 김 가 루 식 초 다 진 청 양 고 추 후 춧 가 루 김 치 국 물 통 깨 다 진 생 강 설 탕 물 굴 소 스 통 깨 구 운 소 금 통 깨 통 깨 매 실 청 후 춧 가 루 생 강 가 루 물 엿 통 깨 밀 가 루 후 춧 가 루 맛 술 맛 술 올 리 고 당 후 춧 가 루 후 춧 가 루 설 탕 식 초 생 강 구 운 소 금 후 춧 가 루 후 춧 가 루 고 추 장 참 기 름 소 금 설 탕 다 진 파 후 춧 가 루 쥬 키 니 호 박 식 초 간 장 설 탕 다 진 파 맛 술 식 용 유 맛 술 다 진 마 늘 생 강 가 루 다 진 파 간 장 생 강 즙 생 강 즙 
21,간단한 재료로 뚝딱,당근전,https://static.wtable.co.kr/image/production/service/recipe/1914/53c9162a-25ab-449a-a653-6f7363535f26.jpg?size=500x500,초급,0,https://wtable.co.kr/recipes/SD5cDfLMKZQefnfcJtWhPVKK?location=recipe_home,20분,"['당근', '전분', '소금', '식용유', '다', '진', ' ', '양', '파', '간', '장', '연', '겨', '자', '다', '진', ' ', '마', '늘', '고', '춧', '가', '루', '물', '물', '참', '기', '름', '설', '탕', '설', '탕', '후', '춧', '가', '루', '후', '춧', '가', '루', '생', '강', '가', '루', '후', '춧', '가', '루', '식', '초', '비', '트', '즙', '식', '초', '설', '탕', '물', '연', '겨', '자', '생', '강', '가', '루', '고', '춧', '가', '루', '맛', '술', '고', '추', '장', '참', '기', '름', '식', '초', '소', '금', '매', '실', '청', '맛', '술', '후', '춧', '가', '루', '달', '걀', '간', '장', '애', '호', '박', '식', '초', '참', '기', '름', '후', '춧', '가', '루', '다', '진', '마', '늘', '올', '리', '고', '당', '후', '춧', '가', '루', '후', '춧', '가', '루']",간단한 재료로 뚝딱 당근전  당근 전분 소금 식용유 다 진 양 파 간 장 연 겨 자 다 진 마 늘 고 춧 가 루 물 물 참 기 름 설 탕 설 탕 후 춧 가 루 후 춧 가 루 생 강 가 루 후 춧 가 루 식 초 비 트 즙 식 초 설 탕 물 연 겨 자 생 강 가 루 고 춧 가 루 맛 술 고 추 장 참 기 름 식 초 소 금 매 실 청 맛 술 후 춧 가 루 달 걀 간 장 애 호 박 식 초 참 기 름 후 춧 가 루 다 진 마 늘 올 리 고 당 후 춧 가 루 후 춧 가 루 
22,Vege is,김치말이두부찜,https://static.wtable.co.kr/image/production/service/recipe/1906/342f6e9f-dc79-4a18-98f2-5a51c79045fa.jpg?size=500x500,초급,0,https://wtable.co.kr/recipes/w9xaXdiN1Kb3cmFmLy6pq5od?location=recipe_home,30분,"['신김치', '두부', '느타리 한줌', '양파', '대파', '채수', '들기름', '간장', '된장', '고춧가루', '김치국물', '다진 마늘', '설탕', '후춧가루', '청', '고', '추', '식', '초', '설', '탕', '깨', '고', '추', '장', '올', '리', '고', '당', '매', '실', '청', '후', '춧', '가', '루', '소', '금', '물', '엿', '후', '춧', '가', '루', '다', '진', ' ', '마', '늘', '소', '금', '다', '진', ' ', '청', ',', ' ', '홍', '고', '추', '올', '리', '고', '당', '설', '탕', '후', '춧', '가', '루', '국', '간', '장', '국', '간', '장', '된', '장', '잔', '멸', '치', '소', '금', '후', '춧', '가', '루', '다', '진', '마', '늘', '설', '탕', '부', '침', '가', '루', '식', '초', '부', '침', '가', '루', '통', '깨', '참', '기', '름', '맛', '술']",  김치말이두부찜  신김치 두부 느타리 한줌 양파 대파 채수 들기름 간장 된장 고춧가루 김치국물 다진 마늘 설탕 후춧가루 청 고 추 식 초 설 탕 깨 고 추 장 올 리 고 당 매 실 청 후 춧 가 루 소 금 물 엿 후 춧 가 루 다 진 마 늘 소 금 다 진 청 홍 고 추 올 리 고 당 설 탕 후 춧 가 루 국 간 장 국 간 장 된 장 잔 멸 치 소 금 후 춧 가 루 다 진 마 늘 설 탕 부 침 가 루 식 초 부 침 가 루 통 깨 참 기 름 맛 술 
23,쫄깃한 식감과 은은한 향의,표고버섯 덮밥,https://static.wtable.co.kr/image/production/service/recipe/1897/4f7f4e41-5067-45e2-abd4-e8fcca34fea7.jpg?size=500x500,초급,0,https://wtable.co.kr/recipes/f2v1e5Kd4caoW1vZcwrsJG7v?location=recipe_home,30분,"['표고버섯', '양파', '대파', '다진 마늘', '참기름', '식용유', '통깨', '레드페퍼', '밥', '간장', '올리고당', '맛술', '설탕', '참기름', '후추가루', '설', '탕', '연', '유', '참', '기', '름', '참', '치', '액', '소', '금', '설', '탕', '국', '간', '장', '고', '운', ' ', '고', '춧', '가', '루', '후', '춧', '가', '루', '밀', '가', '루', ' ', '통', '깨', '물', '연', '유', '녹', '말', '가', '루', '맛', '술', '들', '기', '름', '고', '춧', '가', '루', '모', '듬', '견', '과', '류', '후', '춧', '가', '루', '참', '기', '름', '올', '리', '고', '당', '참', '기', '름', '설', '탕', '달', '걀', '후', '춧', '가', '루', '생', '강', '가', '루', '참', '기', '름']",쫄깃한 식감과 은은한 향의 표고버섯 덮밥  표고버섯 양파 대파 다진 마늘 참기름 식용유 통깨 레드페퍼 밥 간장 올리고당 맛술 설탕 참기름 후추가루 설 탕 연 유 참 기 름 참 치 액 소 금 설 탕 국 간 장 고 운 고 춧 가 루 후 춧 가 루 밀 가 루 통 깨 물 연 유 녹 말 가 루 맛 술 들 기 름 고 춧 가 루 모 듬 견 과 류 후 춧 가 루 참 기 름 올 리 고 당 참 기 름 설 탕 달 걀 후 춧 가 루 생 강 가 루 참 기 름 
24,봄 내음 물씬~,냉이 차돌박이 솥밥,https://static.wtable.co.kr/image/production/service/recipe/1898/19cb9872-c36f-45de-9fa3-dcd9e8290b64.jpg?size=500x500,중급,1,https://wtable.co.kr/recipes/8FG95ChaKzuqwGq4Mz1P5k74?location=recipe_home,50분,"['냉이', '차돌박이', '쌀', '다시마 육수', '간장', '다진 마늘', '올리고당', '참기름', '후춧가루', '다진 양파', '송송 썬 쪽파', '간장', '맛술', '다진 마늘', '참기름', '매실청 ', '통깨', '후', '춧', '가', '루', '간', '장', '국', '간', '장', '참', '기', '름', '굵', '은', ' ', '소', '금', '다', '진', ' ', '마', '늘', '생', '강', ' ', '가', '루', '통', '깨', '시', '금', '치', '즙', '쌈', '장', '간', '장', '육', '수', '다', '진', ' ', '마', '늘', '다', '진', ' ', '마', '늘', '맛', '술', '통', '깨', '물', '소', '금', '연', '겨', '자', '홍', '고', '추', '후', '춧', '가', '루', '통', '깨']",봄 내음 물씬  냉이 차돌박이 솥밥  냉이 차돌박이 쌀 다시마 육수 간장 다진 마늘 올리고당 참기름 후춧가루 다진 양파 송송 썬 쪽파 간장 맛술 다진 마늘 참기름 매실청 통깨 후 춧 가 루 간 장 국 간 장 참 기 름 굵 은 소 금 다 진 마 늘 생 강 가 루 통 깨 시 금 치 즙 쌈 장 간 장 육 수 다 진 마 늘 다 진 마 늘 맛 술 통 깨 물 소 금 연 겨 자 홍 고 추 후 춧 가 루 통 깨 
