id,subtitle,title,img_url,level,level_code,link,time,element,feature
1,LG 광파오븐 레시피,고추전,https://static.wtable.co.kr/image/production/service/recipe/2344/9a1bd1e4-cbf9-4e2c-857a-56c95078bf4c.jpg?size=500x500,중급,1,https://wtable.co.kr/recipes/SyRXB1s98K1pUgygqB9wwPHD?location=recipe_home,30분,"['아삭이고추', '다진 돼지고기', '두부', '양파', '부침가루', '계란 흰자', '홍고추', '굴소스', '청주', '다진 마늘', '생강가루', '참기름', '소금', '후춧가루', '달걀', '부침가루', '진간장', '물', '설탕', '식초', '다진 양파', '청고추', '아', '삭', '이', '고', '추', '황', '태', '성', '게', '멍', '게', '생', ' ', '곤', '드', '레', '불', '린', ' ', '쌀', '불', '린', ' ', '미', '역', '부', '지', '깽', '이', '아', '욱', '근', '대', '가', '래', '떡', '고', '등', '어', ' ', '필', '렛', '도', '토', '리', '가', '루', '목', '살', '배', '표', '고', '가', '지', '신', '김', '치', '열', '무', '자', '른', ' ', '쇠', '고', '기', ' ', '양', '지', '당', '근', '신', '김', '치', '표', '고', '버', '섯', '냉', '이', '얼', '갈', '이', '배', '추', '청', '양', '고', '추', '불', '린', ' ', '쌀', '비', '타', '민', '불', '린', ' ', '쌀', '불', '린', ' ', '쌀', '불', '린', ' ', '쌀', '불', '린', ' ', '쌀', '불', '린', ' ', '쌀', '두', '부', '불', '린', ' ', '쌀', '돼', '지', '고', '기', '굴', '소', '고', '기', ' ', '북', '어', '채', '대', '패', '삼', '겹', '살', '소', '고', '기', '대', '패', '삼', '겹', '살', '닭', '홍', '합', '감', '자', '새', '우', '프', '랑', '크', '소', '시', '지', '두', '부', '참', '가', '자', '미', '무', '우', '섬', '초', '조', '선', '호', '박', '데', '친', ' ', '쑥', '미', '더', '덕', '꼬', '막', '검', '은', '콩', '통', '마', '늘', '고', '구', '마', '시', '금', '치', '불', '린', ' ', '쌀', '닭', '가', '슴', '살', '현', '미', '밥', '김', '달', '걀', '배', '추', '김', '치', '가', '지', '묵', '은', '지', '대', '하', '케', '일', '소', '고', '기', ' ', '양', '지', '김', '밥', '용', ' ', '김', '자', '숙', ' ', '홍', '합', '살', 'L', 'A', '갈', '비', '새', '꼬', '막', '명', '란', '젓', '다', '진', ' ', '소', '고', '기', '두', '부', '청', '양', '고', '추', '두', '부', '두', '부', '감', '자', '감', '자', '건', '당', '면', '멸', '치', '다', '시', '육', '수', '떡', '국', '용', ' ', '떡', '시', '판', ' ', '된', '장', '떡', '국', '용', ' ', '떡', '봄', '동', '봄', '동', '봄', '동', '브', '로', '콜', '리', '굴', '가', '지', '낙', '지', '차', '돌', '박', '이', ' ', '깻', '잎', '소', '고', '기', ' ', '갈', '비', '배', '추', '돼', '지', '고', '기', '현', '미', '밥', '삶', '은', ' ', '시', '래', '기', '나', '물', '달', '걀', '양', '배', '추', '양', '배', '추', '스', '팸', '단', '무', '지', '깻', '잎', '부', '침', ' ', '두', '부', '소', '갈', '비', '밥', '가', '지', '순', '두', '부', '무', '삼', '겹', '살', ' ', '묵', '은', '지', '청', '양', '고', '추', '쌀', '배', '추', '콩', '나', '물', '건', '미', '역', ' ', '참', '치', '캔', '달', '걀', '두', '부', '달', '걀', '굴', '손', '질', ' ', '한', ' ', '늙', '은', '호', '박', '밥', '고', '사', '리', '통', ' ', '삼', '겹', '살', ' ', '무', '국', '수', '호', '박', '손', '질', ' ', '낙', '지', '단', '감', '잘', '게', ' ', '썬', ' ', '배', '추', '김', '치', ' ', '쪽', '파', '굴', '두', '부', '육', '전', '배', '추', '소', '갈', '비', '애', '호', '박', '모', '둠', ' ', '건', ' ', '해', '초', '배', '추', '모', '둠', ' ', '건', ' ', '해', '초', '삼', '겹', '살', ' ', '또', '는', ' ', '오', '겹', '살', '쇠', '고', '기', '쌀', '가', '지', '손', '질', '된', ' ', '한', '치', '청', '국', '장', '당', '근', '두', '부', '김', '밥', '\xa0', '김', '쇠', '고', '기', ' ', '중', '면', '중', '면', '양', '배', '추', '소', '면', '달', '걀', '비', '건', ' ', '소', '시', '지', '콩', '나', '물', ' ', '검', '은', '콩', ' ', '배', '추', '골', '뱅', '이', ' ', '통', '조', '림', '참', '소', '라', '배', '추', '쌀', '쌀', '쌀', '갓', ' ', '지', '은', ' ', '솥', '밥', '데', '친', ' ', '쑥', '데', '친', ' ', '쑥', '제', '주', ' ', '삼', '겹', '살', '미', '더', '덕', '꽃', '게', ' ', '꽃', '게', ' ', '오', '이', '청', '포', '묵', '애', '호', '박', '표', '고', '버', '섯', '두', '릅', '마', '늘', '종', '연', '근', '두', '릅', '돼', '지', '고', '기', '두', '부', '돼', '지', '고', '기', ' ', '콩', '나', '물', '가', '지', '콩', '나', '물', '김', '치', '오', '징', '어', ' ', '오', '이', '고', '추', '달', '래', '미', '나', '리', '미', '나', '리', '두', '부', ' ', '쌈', ' ', '다', '시', '마', ' ', '톳', '물', '바', '지', '락', '쌀', '흑', '돼', '지', ' ', '삼', '겹', '살', '양', '파', '톳', '\xa0', '장', '아', '찌', '쌀', '대', '파', '달', '걀', '자', '숙', ' ', '문', '어', '시', '금', '치', '나', '물', '묵', '은', '지', '김', '밥', '용', '김', '당', '면', '조', '랭', '이', '떡', '닭', '간', ' ', '돼', '지', '고', '기', '왕', '만', '두', '제', '주', '\xa0', '밥', '심', '\xa0', '누', '룽', '지', '깐', ' ', '더', '덕', '쇠', '고', '기', ' ', '매', '생', '이', '무', '굴', '조', '랭', '이', '떡', '가', '래', '떡', '칼', '국', '수', ' ', '면', '자', '숙', '\xa0', '꼬', '막', '살', '꽁', '치', '통', '조', '림', '삶', '은', '꼬', '막', '감', '태', '무', '무', '말', '랭', '이', '삶', '은', ' ', '시', '래', '기', '나', '물', '총', '각', '무', '저', '염', '\xa0', '명', '란', '젓', '중', '면', '두', '부', '모', '둠', '전', '손', '질', '한', ' ', '고', '구', '마', '줄', '기', '표', '고', '버', '섯', '삶', '은', ' ', '고', '사', '리', '훈', '제', '오', '리', '낙', '지', '새', '우', '쌀', '알', '배', '추', '깐', '도', '라', '지', '쌀', '밥', '오', '이', '풋', '고', '추', '김', '말', '이', '오', '이', '지', '칼', '국', '수', '면', '초', '당', ' ', '옥', '수', '수', '골', '뱅', '이', ' ', '통', '조', '림', '밥', '쇠', '고', '기', '달', '걀', '두', '부', '콩', '나', '물', '차', '돌', '박', '이', '돼', '지', '고', '기', '감', '자', ' ', '미', '나', '리', '꽁', '치', '통', '조', '림', '두', '릅', '간', '장', '쌀', '냉', '이', '사', '과', '알', '배', '추', '관', '자', '무', '마', '늘', '쪽', '파', '찹', '쌀', '달', '걀', '달', '걀', '돼', '지', '고', '기', '엿', '기', '름', '새', '우', '새', '우', '아', '귀', '코', '다', '리', '팥', '쇠', '고', '기', '돼', '지', '등', '뼈', '꽃', '게', '돼', '지', '고', '기', ' ', '목', '살', '늙', '은', ' ', '호', '박', '고', '등', '어', '쇠', '고', '기', '차', '돌', '박', '이', '낙', '지', '감', '자', '쇠', '고', '기', '건', '미', '역', ' ', '항', '정', '살', '건', '새', '우', '깻', '잎', '파', '래', '김', '갈', '비', '배', '콩', '나', '물', '쇠', '고', '기', '건', '미', '역', '닭', '오', '징', '어', '채', '명', '란', '젓', '차', '돌', '박', '이', '돼', '지', '고', '기', '부', '추', '깍', '두', '기', '오', '이', '꽈', '리', '고', '추', '가', '지', '양', '배', '추', '삼', '계', '탕', '용', ' ', '닭', '마', '늘', '종', '소', '면', '감', '자', '해', '삼', '서', '리', '태', '순', '대', '오', '이', '묵', '은', '지', '표', '고', '버', '섯', '브', '로', '콜', '리', '생', '삼', '겹', '살', '나', '무', '두', '릅', '비', '엔', '나', '소', '시', '지', '마', '늘', '종', '쇠', '고', '기', '도', '미', '냉', '이', '돌', '문', '어', '황', '태', '포', '우', '엉', '두', '부', '봄', '동', '닭', '볶', '음', '탕', '용', ' ', '닭', '오', '징', '어', '게', '맛', '살', '딱', '새', '우', '쌈', '무', '표', '고', '버', '섯', '쪽', '파', '삼', '겹', '살', '어', '묵', '닭', '무', '대', '구', '알', ' ', '또', '는', ' ', '명', '란', '콩', '나', '물', '멍', '게', '애', '호', '박', '쇠', '고', '기', ' ', '등', '심', '애', '호', '박', '시', '금', '치', '고', '구', '마', '줄', '기', '낙', '지', '달', '걀', '오', '징', '어', '도', '토', '리', '묵', '당', '면', '오', '이', '골', '뱅', '이', '통', '조', '림', '취', '나', '물', '미', '나', '리', '오', '이', '냉', '이', '취', '나', '물', '주', '꾸', '미', '당', '근', '돼', '지', '갈', '비', '닭', '쇠', '고', '기', '율', '무', '밥', '현', '미', '밥', '동', '태', '돼', '지', '고', '기', '불', '린', ' ', '시', '래', '기', '나', '물', '굴', '단', '호', '박', '달', '걀', '낙', '지', '콩', '나', '물', '애', '호', '박', '알', '감', '자', '닭', '쇠', '고', '기', '감', '자', '달', '걀', '어', '묵', '쇠', '고', '기', '돼', '지', '고', '기', '쌀', '봄', '동', '염', '장', ' ', '미', '역', '줄', '기', '멸', '치', '갑', '오', '징', '어', '잔', '멸', '치', '고', '등', '어', '감', '자', '오', '징', '어', '명', '엽', '채', '돼', '지', '고', '기', '오', '징', '어', '채', '메', '추', '리', '알', '밥', '멸', '치', '깻', '잎', '갈', '치', '닭', '다', '리', '살', '코', '다', '리', '닭', '다', '리', '살', '돼', '지', '고', '기', '찹', '쌀', '주', '꾸', '미', '가', '지', '무']", 광파오븐 레시피 고추전  아삭이고추 다진 돼지고기 두부 양파 부침가루 계란 흰자 홍고추 굴소스 청주 다진 마늘 생강가루 참기름 소금 후춧가루 달걀 부침가루 진간장 물 설탕 식초 다진 양파 청고추 아 삭 이 고 추 황 태 성 게 멍 게 생 곤 드 레 불 린 쌀 불 린 미 역 부 지 깽 이 아 욱 근 대 가 래 떡 고 등 어 필 렛 도 토 리 가 루 목 살 배 표 고 가 지 신 김 치 열 무 자 른 쇠 고 기 양 지 당 근 신 김 치 표 고 버 섯 냉 이 얼 갈 이 배 추 청 양 고 추 불 린 쌀 비 타 민 불 린 쌀 불 린 쌀 불 린 쌀 불 린 쌀 불 린 쌀 두 부 불 린 쌀 돼 지 고 기 굴 소 고 기 북 어 채 대 패 삼 겹 살 소 고 기 대 패 삼 겹 살 닭 홍 합 감 자 새 우 프 랑 크 소 시 지 두 부 참 가 자 미 무 우 섬 초 조 선 호 박 데 친 쑥 미 더 덕 꼬 막 검 은 콩 통 마 늘 고 구 마 시 금 치 불 린 쌀 닭 가 슴 살 현 미 밥 김 달 걀 배 추 김 치 가 지 묵 은 지 대 하 케 일 소 고 기 양 지 김 밥 용 김 자 숙 홍 합 살 갈 비 새 꼬 막 명 란 젓 다 진 소 고 기 두 부 청 양 고 추 두 부 두 부 감 자 감 자 건 당 면 멸 치 다 시 육 수 떡 국 용 떡 시 판 된 장 떡 국 용 떡 봄 동 봄 동 봄 동 브 로 콜 리 굴 가 지 낙 지 차 돌 박 이 깻 잎 소 고 기 갈 비 배 추 돼 지 고 기 현 미 밥 삶 은 시 래 기 나 물 달 걀 양 배 추 양 배 추 스 팸 단 무 지 깻 잎 부 침 두 부 소 갈 비 밥 가 지 순 두 부 무 삼 겹 살 묵 은 지 청 양 고 추 쌀 배 추 콩 나 물 건 미 역 참 치 캔 달 걀 두 부 달 걀 굴 손 질 한 늙 은 호 박 밥 고 사 리 통 삼 겹 살 무 국 수 호 박 손 질 낙 지 단 감 잘 게 썬 배 추 김 치 쪽 파 굴 두 부 육 전 배 추 소 갈 비 애 호 박 모 둠 건 해 초 배 추 모 둠 건 해 초 삼 겹 살 또 는 오 겹 살 쇠 고 기 쌀 가 지 손 질 된 한 치 청 국 장 당 근 두 부 김 밥 김 쇠 고 기 중 면 중 면 양 배 추 소 면 달 걀 비 건 소 시 지 콩 나 물 검 은 콩 배 추 골 뱅 이 통 조 림 참 소 라 배 추 쌀 쌀 쌀 갓 지 은 솥 밥 데 친 쑥 데 친 쑥 제 주 삼 겹 살 미 더 덕 꽃 게 꽃 게 오 이 청 포 묵 애 호 박 표 고 버 섯 두 릅 마 늘 종 연 근 두 릅 돼 지 고 기 두 부 돼 지 고 기 콩 나 물 가 지 콩 나 물 김 치 오 징 어 오 이 고 추 달 래 미 나 리 미 나 리 두 부 쌈 다 시 마 톳 물 바 지 락 쌀 흑 돼 지 삼 겹 살 양 파 톳 장 아 찌 쌀 대 파 달 걀 자 숙 문 어 시 금 치 나 물 묵 은 지 김 밥 용 김 당 면 조 랭 이 떡 닭 간 돼 지 고 기 왕 만 두 제 주 밥 심 누 룽 지 깐 더 덕 쇠 고 기 매 생 이 무 굴 조 랭 이 떡 가 래 떡 칼 국 수 면 자 숙 꼬 막 살 꽁 치 통 조 림 삶 은 꼬 막 감 태 무 무 말 랭 이 삶 은 시 래 기 나 물 총 각 무 저 염 명 란 젓 중 면 두 부 모 둠 전 손 질 한 고 구 마 줄 기 표 고 버 섯 삶 은 고 사 리 훈 제 오 리 낙 지 새 우 쌀 알 배 추 깐 도 라 지 쌀 밥 오 이 풋 고 추 김 말 이 오 이 지 칼 국 수 면 초 당 옥 수 수 골 뱅 이 통 조 림 밥 쇠 고 기 달 걀 두 부 콩 나 물 차 돌 박 이 돼 지 고 기 감 자 미 나 리 꽁 치 통 조 림 두 릅 간 장 쌀 냉 이 사 과 알 배 추 관 자 무 마 늘 쪽 파 찹 쌀 달 걀 달 걀 돼 지 고 기 엿 기 름 새 우 새 우 아 귀 코 다 리 팥 쇠 고 기 돼 지 등 뼈 꽃 게 돼 지 고 기 목 살 늙 은 호 박 고 등 어 쇠 고 기 차 돌 박 이 낙 지 감 자 쇠 고 기 건 미 역 항 정 살 건 새 우 깻 잎 파 래 김 갈 비 배 콩 나 물 쇠 고 기 건 미 역 닭 오 징 어 채 명 란 젓 차 돌 박 이 돼 지 고 기 부 추 깍 두 기 오 이 꽈 리 고 추 가 지 양 배 추 삼 계 탕 용 닭 마 늘 종 소 면 감 자 해 삼 서 리 태 순 대 오 이 묵 은 지 표 고 버 섯 브 로 콜 리 생 삼 겹 살 나 무 두 릅 비 엔 나 소 시 지 마 늘 종 쇠 고 기 도 미 냉 이 돌 문 어 황 태 포 우 엉 두 부 봄 동 닭 볶 음 탕 용 닭 오 징 어 게 맛 살 딱 새 우 쌈 무 표 고 버 섯 쪽 파 삼 겹 살 어 묵 닭 무 대 구 알 또 는 명 란 콩 나 물 멍 게 애 호 박 쇠 고 기 등 심 애 호 박 시 금 치 고 구 마 줄 기 낙 지 달 걀 오 징 어 도 토 리 묵 당 면 오 이 골 뱅 이 통 조 림 취 나 물 미 나 리 오 이 냉 이 취 나 물 주 꾸 미 당 근 돼 지 갈 비 닭 쇠 고 기 율 무 밥 현 미 밥 동 태 돼 지 고 기 불 린 시 래 기 나 물 굴 단 호 박 달 걀 낙 지 콩 나 물 애 호 박 알 감 자 닭 쇠 고 기 감 자 달 걀 어 묵 쇠 고 기 돼 지 고 기 쌀 봄 동 염 장 미 역 줄 기 멸 치 갑 오 징 어 잔 멸 치 고 등 어 감 자 오 징 어 명 엽 채 돼 지 고 기 오 징 어 채 메 추 리 알 밥 멸 치 깻 잎 갈 치 닭 다 리 살 코 다 리 닭 다 리 살 돼 지 고 기 찹 쌀 주 꾸 미 가 지 무 
